python/tvm/relay/transform/logs/autotvm_ops_rtx2070.json
{"input": ["cuda -keys=cuda,gpu -max_num_threads=1024 -model=unknown -thread_warp_size=32", "conv3d_ncdhw.cuda", [["TENSOR", [1, 1024, 1, 14, 14], "float32"], ["TENSOR", [2048, 1024, 1, 1, 1], "float32"], [2, 2, 2], [0, 0, 0, 0, 0, 0], [1, 1, 1], "float32"], {}], "config": {"index": 341913, "code_hash": null, "entity": [["tile_f", "sp", [-1, 2, 16, 2]], ["tile_d", "sp", [-1, 1, 1, 1]], ["tile_y", "sp", [-1, 1, 1, 7]], ["tile_x", "sp", [-1, 1, 7, 1]], ["tile_rc", "sp", [-1, 8]], ["tile_rd", "sp", [-1, 1]], ["tile_ry", "sp", [-1, 1]], ["tile_rx", "sp", [-1, 1]], ["auto_unroll_max_step", "ot", 1500], ["unroll_explicit", "ot", 1]]}, "result": [[0.00014953023368551897], 0, 1.787668228149414, 1626832855.2365348], "version": 0.2, "tvm_version": "0.8.dev0"}
{"input": ["cuda -keys=cuda,gpu -max_num_threads=1024 -model=unknown -thread_warp_size=32", "conv3d_ncdhw.cuda", [["TENSOR", [1, 512, 2, 28, 28], "float32"], ["TENSOR", [1024, 512, 1, 1, 1], "float32"], [2, 2, 2], [0, 0, 0, 0, 0, 0], [1, 1, 1], "float32"], {}], "config": {"index": 1724048, "code_hash": null, "entity": [["tile_f", "sp", [-1, 4, 16, 1]], ["tile_d", "sp", [-1, 1, 1, 1]], ["tile_y", "sp", [-1, 1, 1, 7]], ["tile_x", "sp", [-1, 1, 14, 1]], ["tile_rc", "sp", [-1, 8]], ["tile_rd", "sp", [-1, 1]], ["tile_ry", "sp", [-1, 1]], ["tile_rx", "sp", [-1, 1]], ["auto_unroll_max_step", "ot", 1500], ["unroll_explicit", "ot", 0]]}, "result": [[0.0001134384493163602], 0, 1.605334758758545, 1626834506.3055696], "version": 0.2, "tvm_version": "0.8.dev0"}
{"input": ["cuda -keys=cuda,gpu -max_num_threads=1024 -model=unknown -thread_warp_size=32", "conv3d_ncdhw.cuda", [["TENSOR", [1, 256, 3, 56, 56], "float32"], ["TENSOR", [512, 256, 1, 1, 1], "float32"], [2, 2, 2], [0, 0, 0, 0, 0, 0], [1, 1, 1], "float32"], {}], "config": {"index": 54093727, "code_hash": null, "entity": [["tile_f", "sp", [-1, 2, 16, 4]], ["tile_d", "sp", [-1, 1, 1, 1]], ["tile_y", "sp", [-1, 1, 1, 7]], ["tile_x", "sp", [-1, 2, 14, 1]], ["tile_rc", "sp", [-1, 4]], ["tile_rd", "sp", [-1, 1]], ["tile_ry", "sp", [-1, 1]], ["tile_rx", "sp", [-1, 1]], ["auto_unroll_max_step", "ot", 512], ["unroll_explicit", "ot", 1]]}, "result": [[0.00015127483145363407], 0, 2.105794668197632, 1626836416.5795271], "version": 0.2, "tvm_version": "0.8.dev0"}
{"input": ["cuda -keys=cuda,gpu -max_num_threads=1024 -model=unknown -thread_warp_size=32", "conv3d_ncdhw.cuda", [["TENSOR", [1, 64, 3, 56, 56], "float32"], ["TENSOR", [64, 64, 1, 1, 1], "float32"], [1, 1, 1], [0, 0, 0, 0, 0, 0], [1, 1, 1], "float32"], {}], "config": {"index": 37336632, "code_hash": null, "entity": [["tile_f", "sp", [-1, 4, 4, 4]], ["tile_d", "sp", [-1, 1, 1, 3]], ["tile_y", "sp", [-1, 1, 1, 1]], ["tile_x", "sp", [-1, 1, 56, 1]], ["tile_rc", "sp", [-1, 8]], ["tile_rd", "sp", [-1, 1]], ["tile_ry", "sp", [-1, 1]], ["tile_rx", "sp", [-1, 1]], ["auto_unroll_max_step", "ot", 1500], ["unroll_explicit", "ot", 0]]}, "result": [[2.5136793307920373e-05], 0, 1.8463356494903564, 1626841497.583926], "version": 0.2, "tvm_version": "0.8.dev0"}
{"input": ["cuda -keys=cuda,gpu -max_num_threads=1024 -model=unknown -thread_warp_size=32", "conv3d_ncdhw.cuda", [["TENSOR", [1, 256, 3, 56, 56], "float32"], ["TENSOR", [64, 256, 1, 1, 1], "float32"], [1, 1, 1], [0, 0, 0, 0, 0, 0], [1, 1, 1], "float32"], {}], "config": {"index": 80831255, "code_hash": null, "entity": [["tile_f", "sp", [-1, 1, 4, 8]], ["tile_d", "sp", [-1, 1, 1, 1]], ["tile_y", "sp", [-1, 2, 2, 1]], ["tile_x", "sp", [-1, 1, 28, 2]], ["tile_rc", "sp", [-1, 2]], ["tile_rd", "sp", [-1, 1]], ["tile_ry", "sp", [-1, 1]], ["tile_rx", "sp", [-1, 1]], ["auto_unroll_max_step", "ot", 512], ["unroll_explicit", "ot", 1]]}, "result": [[9.294127469135802e-05], 0, 1.3222432136535645, 1626845209.9623892], "version": 0.2, "tvm_version": "0.8.dev0"}
{"input": ["cuda -keys=cuda,gpu -max_num_threads=1024 -model=unknown -thread_warp_size=32", "conv3d_ncdhw_winograd.cuda", [["TENSOR", [1, 64, 3, 56, 56], "float32"], ["TENSOR", [64, 64, 3, 3, 3], "float32"], [1, 1, 1], [1, 1, 1, 1, 1, 1], [1, 1, 1], "float32"], {}], "config": {"index": 330052, "code_hash": null, "entity": [["tile_b", "sp", [-1, 1, 1, 1]], ["tile_y", "sp", [-1, 8, 4, 1]], ["tile_x", "sp", [-1, 7, 28, 1]], ["tile_rc", "sp", [-1, 16]], ["auto_unroll_max_step", "ot", 1500], ["unroll_explicit", "ot", 1]]}, "result": [[0.0034816464318181816], 0, 8.696326971054077, 1626847672.2059176], "version": 0.2, "tvm_version": "0.8.dev0"}
{"input": ["cuda -keys=cuda,gpu -max_num_threads=1024 -model=unknown -thread_warp_size=32", "conv3d_ncdhw.cuda", [["TENSOR", [1, 64, 3, 56, 56], "float32"], ["TENSOR", [64, 64, 3, 3, 3], "float32"], [1, 1, 1], [1, 1, 1, 1, 1, 1], [1, 1, 1], "float32"], {}], "config": {"index": 633481442, "code_hash": null, "entity": [["tile_f", "sp", [-1, 2, 8, 4]], ["tile_d", "sp", [-1, 3, 1, 1]], ["tile_y", "sp", [-1, 2, 1, 1]], ["tile_x", "sp", [-1, 1, 28, 2]], ["tile_rc", "sp", [-1, 1]], ["tile_rd", "sp", [-1, 1]], ["tile_ry", "sp", [-1, 3]], ["tile_rx", "sp", [-1, 1]], ["auto_unroll_max_step", "ot", 1500], ["unroll_explicit", "ot", 1]]}, "result": [[0.0004307424927536232], 0, 2.110707998275757, 1626852095.2439368], "version": 0.2, "tvm_version": "0.8.dev0"}
{"input": ["cuda -keys=cuda,gpu -max_num_threads=1024 -model=unknown -thread_warp_size=32", "conv3d_ncdhw.cuda", [["TENSOR", [1, 64, 3, 56, 56], "float32"], ["TENSOR", [256, 64, 1, 1, 1], "float32"], [1, 1, 1], [0, 0, 0, 0, 0, 0], [1, 1, 1], "float32"], {}], "config": {"index": 73306268, "code_hash": null, "entity": [["tile_f", "sp", [-1, 4, 8, 2]], ["tile_d", "sp", [-1, 1, 1, 1]], ["tile_y", "sp", [-1, 1, 1, 2]], ["tile_x", "sp", [-1, 2, 28, 1]], ["tile_rc", "sp", [-1, 8]], ["tile_rd", "sp", [-1, 1]], ["tile_ry", "sp", [-1, 1]], ["tile_rx", "sp", [-1, 1]], ["auto_unroll_max_step", "ot", 1500], ["unroll_explicit", "ot", 0]]}, "result": [[8.397683180592993e-05], 0, 1.5550029277801514, 1626856499.3769267], "version": 0.2, "tvm_version": "0.8.dev0"}
{"input": ["cuda -keys=cuda,gpu -max_num_threads=1024 -model=unknown -thread_warp_size=32", "conv3d_ncdhw.cuda", [["TENSOR", [1, 256, 3, 56, 56], "float32"], ["TENSOR", [128, 256, 1, 1, 1], "float32"], [1, 1, 1], [0, 0, 0, 0, 0, 0], [1, 1, 1], "float32"], {}], "config": {"index": 65601656, "code_hash": null, "entity": [["tile_f", "sp", [-1, 4, 8, 2]], ["tile_d", "sp", [-1, 1, 1, 1]], ["tile_y", "sp", [-1, 1, 1, 2]], ["tile_x", "sp", [-1, 2, 28, 1]], ["tile_rc", "sp", [-1, 8]], ["tile_rd", "sp", [-1, 1]], ["tile_ry", "sp", [-1, 1]], ["tile_rx", "sp", [-1, 1]], ["auto_unroll_max_step", "ot", 1500], ["unroll_explicit", "ot", 0]]}, "result": [[0.000154254394], 0, 1.2664210796356201, 1626858167.1636937], "version": 0.2, "tvm_version": "0.8.dev0"}
{"input": ["cuda -keys=cuda,gpu -max_num_threads=1024 -model=unknown -thread_warp_size=32", "conv3d_ncdhw.cuda", [["TENSOR", [1, 128, 3, 56, 56], "float32"], ["TENSOR", [128, 128, 3, 3, 3], "float32"], [2, 2, 2], [1, 1, 1, 1, 1, 1], [1, 1, 1], "float32"], {}], "config": {"index": 184903282, "code_hash": null, "entity": [["tile_f", "sp", [-1, 1, 16, 4]], ["tile_d", "sp", [-1, 1, 1, 1]], ["tile_y", "sp", [-1, 1, 14, 1]], ["tile_x", "sp", [-1, 1, 1, 7]], ["tile_rc", "sp", [-1, 1]], ["tile_rd", "sp", [-1, 1]], ["tile_ry", "sp", [-1, 3]], ["tile_rx", "sp", [-1, 3]], ["auto_unroll_max_step", "ot", 0], ["unroll_explicit", "ot", 1]]}, "result": [[0.0004752423948051948], 0, 1.5036439895629883, 1626862445.3746288], "version": 0.2, "tvm_version": "0.8.dev0"}
{"input": ["cuda -keys=cuda,gpu -max_num_threads=1024 -model=unknown -thread_warp_size=32", "conv3d_ncdhw.cuda", [["TENSOR", [1, 512, 2, 28, 28], "float32"], ["TENSOR", [128, 512, 1, 1, 1], "float32"], [1, 1, 1], [0, 0, 0, 0, 0, 0], [1, 1, 1], "float32"], {}], "config": {"index": 10491864, "code_hash": null, "entity": [["tile_f", "sp", [-1, 8, 8, 1]], ["tile_d", "sp", [-1, 1, 1, 1]], ["tile_y", "sp", [-1, 1, 1, 2]], ["tile_x", "sp", [-1, 1, 14, 2]], ["tile_rc", "sp", [-1, 8]], ["tile_rd", "sp", [-1, 1]], ["tile_ry", "sp", [-1, 1]], ["tile_rx", "sp", [-1, 1]], ["auto_unroll_max_step", "ot", 512], ["unroll_explicit", "ot", 0]]}, "result": [[7.111977737665463e-05], 0, 1.5816471576690674, 1626867207.958178], "version": 0.2, "tvm_version": "0.8.dev0"}
{"input": ["cuda -keys=cuda,gpu -max_num_threads=1024 -model=unknown -thread_warp_size=32", "conv3d_ncdhw_winograd.cuda", [["TENSOR", [1, 128, 2, 28, 28], "float32"], ["TENSOR", [128, 128, 3, 3, 3], "float32"], [1, 1, 1], [1, 1, 1, 1, 1, 1], [1, 1, 1], "float32"], {}], "config": {"index": 531577, "code_hash": null, "entity": [["tile_b", "sp", [-1, 1, 1, 1]], ["tile_y", "sp", [-1, 1, 8, 8]], ["tile_x", "sp", [-1, 7, 28, 1]], ["tile_rc", "sp", [-1, 16]], ["auto_unroll_max_step", "ot", 1500], ["unroll_explicit", "ot", 1]]}, "result": [[0.0003482937615740741], 0, 3.1912665367126465, 1626868412.792674], "version": 0.2, "tvm_version": "0.8.dev0"}
{"input": ["cuda -keys=cuda,gpu -max_num_threads=1024 -model=unknown -thread_warp_size=32", "conv3d_ncdhw.cuda", [["TENSOR", [1, 128, 2, 28, 28], "float32"], ["TENSOR", [128, 128, 3, 3, 3], "float32"], [1, 1, 1], [1, 1, 1, 1, 1, 1], [1, 1, 1], "float32"], {}], "config": {"index": 259062387, "code_hash": null, "entity": [["tile_f", "sp", [-1, 2, 16, 1]], ["tile_d", "sp", [-1, 2, 1, 1]], ["tile_y", "sp", [-1, 1, 2, 7]], ["tile_x", "sp", [-1, 1, 7, 1]], ["tile_rc", "sp", [-1, 2]], ["tile_rd", "sp", [-1, 1]], ["tile_ry", "sp", [-1, 3]], ["tile_rx", "sp", [-1, 1]], ["auto_unroll_max_step", "ot", 1500], ["unroll_explicit", "ot", 1]]}, "result": [[0.0003255131511470985], 0, 1.9981577396392822, 1626870090.4292524], "version": 0.2, "tvm_version": "0.8.dev0"}
{"input": ["cuda -keys=cuda,gpu -max_num_threads=1024 -model=unknown -thread_warp_size=32", "conv3d_ncdhw.cuda", [["TENSOR", [1, 128, 2, 28, 28], "float32"], ["TENSOR", [512, 128, 1, 1, 1], "float32"], [1, 1, 1], [0, 0, 0, 0, 0, 0], [1, 1, 1], "float32"], {}], "config": {"index": 61145121, "code_hash": null, "entity": [["tile_f", "sp", [-1, 4, 8, 2]], ["tile_d", "sp", [-1, 1, 1, 1]], ["tile_y", "sp", [-1, 7, 1, 1]], ["tile_x", "sp", [-1, 1, 28, 1]], ["tile_rc", "sp", [-1, 8]], ["tile_rd", "sp", [-1, 1]], ["tile_ry", "sp", [-1, 1]], ["tile_rx", "sp", [-1, 1]], ["auto_unroll_max_step", "ot", 1500], ["unroll_explicit", "ot", 1]]}, "result": [[4.825008492106696e-05], 0, 1.5743095874786377, 1626872985.4592493], "version": 0.2, "tvm_version": "0.8.dev0"}
{"input": ["cuda -keys=cuda,gpu -max_num_threads=1024 -model=unknown -thread_warp_size=32", "conv3d_ncdhw.cuda", [["TENSOR", [1, 512, 2, 28, 28], "float32"], ["TENSOR", [256, 512, 1, 1, 1], "float32"], [1, 1, 1], [0, 0, 0, 0, 0, 0], [1, 1, 1], "float32"], {}], "config": {"index": 57492627, "code_hash": null, "entity": [["tile_f", "sp", [-1, 8, 8, 1]], ["tile_d", "sp", [-1, 1, 1, 1]], ["tile_y", "sp", [-1, 1, 1, 7]], ["tile_x", "sp", [-1, 1, 28, 1]], ["tile_rc", "sp", [-1, 16]], ["tile_rd", "sp", [-1, 1]], ["tile_ry", "sp", [-1, 1]], ["tile_rx", "sp", [-1, 1]], ["auto_unroll_max_step", "ot", 1500], ["unroll_explicit", "ot", 1]]}, "result": [[0.00010453124408092983], 0, 2.1381113529205322, 1626875486.4924114], "version": 0.2, "tvm_version": "0.8.dev0"}
{"input": ["cuda -keys=cuda,gpu -max_num_threads=1024 -model=unknown -thread_warp_size=32", "conv3d_ncdhw.cuda", [["TENSOR", [1, 256, 2, 28, 28], "float32"], ["TENSOR", [256, 256, 3, 3, 3], "float32"], [2, 2, 2], [1, 1, 1, 1, 1, 1], [1, 1, 1], "float32"], {}], "config": {"index": 11806344, "code_hash": null, "entity": [["tile_f", "sp", [-1, 1, 8, 4]], ["tile_d", "sp", [-1, 1, 1, 1]], ["tile_y", "sp", [-1, 2, 1, 1]], ["tile_x", "sp", [-1, 1, 14, 1]], ["tile_rc", "sp", [-1, 1]], ["tile_rd", "sp", [-1, 3]], ["tile_ry", "sp", [-1, 3]], ["tile_rx", "sp", [-1, 3]], ["auto_unroll_max_step", "ot", 0], ["unroll_explicit", "ot", 1]]}, "result": [[0.0004342382679856115], 0, 1.6503088474273682, 1626877692.1350675], "version": 0.2, "tvm_version": "0.8.dev0"}
{"input": ["cuda -keys=cuda,gpu -max_num_threads=1024 -model=unknown -thread_warp_size=32", "conv3d_ncdhw.cuda", [["TENSOR", [1, 1024, 1, 14, 14], "float32"], ["TENSOR", [256, 1024, 1, 1, 1], "float32"], [1, 1, 1], [0, 0, 0, 0, 0, 0], [1, 1, 1], "float32"], {}], "config": {"index": 2517272, "code_hash": null, "entity": [["tile_f", "sp", [-1, 4, 16, 1]], ["tile_d", "sp", [-1, 1, 1, 1]], ["tile_y", "sp", [-1, 1, 14, 1]], ["tile_x", "sp", [-1, 1, 1, 2]], ["tile_rc", "sp", [-1, 16]], ["tile_rd", "sp", [-1, 1]], ["tile_ry", "sp", [-1, 1]], ["tile_rx", "sp", [-1, 1]], ["auto_unroll_max_step", "ot", 1500], ["unroll_explicit", "ot", 1]]}, "result": [[5.994674025974026e-05], 0, 1.5024995803833008, 1626880631.3956492], "version": 0.2, "tvm_version": "0.8.dev0"}
{"input": ["cuda -keys=cuda,gpu -max_num_threads=1024 -model=unknown -thread_warp_size=32", "conv3d_ncdhw_winograd.cuda", [["TENSOR", [1, 256, 1, 14, 14], "float32"], ["TENSOR", [256, 256, 3, 3, 3], "float32"], [1, 1, 1], [1, 1, 1, 1, 1, 1], [1, 1, 1], "float32"], {}], "config": {"index": 81543, "code_hash": null, "entity": [["tile_b", "sp", [-1, 1, 1, 1]], ["tile_y", "sp", [-1, 8, 16, 1]], ["tile_x", "sp", [-1, 7, 7, 1]], ["tile_rc", "sp", [-1, 16]], ["auto_unroll_max_step", "ot", 1500], ["unroll_explicit", "ot", 1]]}, "result": [[0.00025805517636986303], 0, 2.543740749359131, 1626881800.8157003], "version": 0.2, "tvm_version": "0.8.dev0"}
{"input": ["cuda -keys=cuda,gpu -max_num_threads=1024 -model=unknown -thread_warp_size=32", "conv3d_ncdhw.cuda", [["TENSOR", [1, 256, 1, 14, 14], "float32"], ["TENSOR", [256, 256, 3, 3, 3], "float32"], [1, 1, 1], [1, 1, 1, 1, 1, 1], [1, 1, 1], "float32"], {}], "config": {"index": 17604870, "code_hash": null, "entity": [["tile_f", "sp", [-1, 1, 16, 1]], ["tile_d", "sp", [-1, 1, 1, 1]], ["tile_y", "sp", [-1, 1, 14, 1]], ["tile_x", "sp", [-1, 1, 1, 7]], ["tile_rc", "sp", [-1, 4]], ["tile_rd", "sp", [-1, 1]], ["tile_ry", "sp", [-1, 3]], ["tile_rx", "sp", [-1, 3]], ["auto_unroll_max_step", "ot", 1500], ["unroll_explicit", "ot", 1]]}, "result": [[0.0002677635133037694], 0, 2.0445008277893066, 1626883939.3515148], "version": 0.2, "tvm_version": "0.8.dev0"}
{"input": ["cuda -keys=cuda,gpu -max_num_threads=1024 -model=unknown -thread_warp_size=32", "conv3d_ncdhw.cuda", [["TENSOR", [1, 256, 1, 14, 14], "float32"], ["TENSOR", [1024, 256, 1, 1, 1], "float32"], [1, 1, 1], [0, 0, 0, 0, 0, 0], [1, 1, 1], "float32"], {}], "config": {"index": 2892637, "code_hash": null, "entity": [["tile_f", "sp", [-1, 8, 8, 1]], ["tile_d", "sp", [-1, 1, 1, 1]], ["tile_y", "sp", [-1, 7, 1, 1]], ["tile_x", "sp", [-1, 1, 14, 1]], ["tile_rc", "sp", [-1, 8]], ["tile_rd", "sp", [-1, 1]], ["tile_ry", "sp", [-1, 1]], ["tile_rx", "sp", [-1, 1]], ["auto_unroll_max_step", "ot", 512], ["unroll_explicit", "ot", 1]]}, "result": [[3.402200099234477e-05], 0, 1.677037239074707, 1626886304.4230554], "version": 0.2, "tvm_version": "0.8.dev0"}
{"input": ["cuda -keys=cuda,gpu -max_num_threads=1024 -model=unknown -thread_warp_size=32", "conv3d_ncdhw.cuda", [["TENSOR", [1, 1024, 1, 14, 14], "float32"], ["TENSOR", [512, 1024, 1, 1, 1], "float32"], [1, 1, 1], [0, 0, 0, 0, 0, 0], [1, 1, 1], "float32"], {}], "config": {"index": 197589, "code_hash": null, "entity": [["tile_f", "sp", [-1, 4, 8, 1]], ["tile_d", "sp", [-1, 1, 1, 1]], ["tile_y", "sp", [-1, 7, 1, 1]], ["tile_x", "sp", [-1, 1, 14, 1]], ["tile_rc", "sp", [-1, 8]], ["tile_rd", "sp", [-1, 1]], ["tile_ry", "sp", [-1, 1]], ["tile_rx", "sp", [-1, 1]], ["auto_unroll_max_step", "ot", 0], ["unroll_explicit", "ot", 0]]}, "result": [[9.280987576687117e-05], 0, 1.5181360244750977, 1626888684.8378432], "version": 0.2, "tvm_version": "0.8.dev0"}
{"input": ["cuda -keys=cuda,gpu -max_num_threads=1024 -model=unknown -thread_warp_size=32", "conv3d_ncdhw.cuda", [["TENSOR", [1, 512, 1, 14, 14], "float32"], ["TENSOR", [512, 512, 3, 3, 3], "float32"], [2, 2, 2], [1, 1, 1, 1, 1, 1], [1, 1, 1], "float32"], {}], "config": {"index": 1629354, "code_hash": null, "entity": [["tile_f", "sp", [-1, 1, 16, 1]], ["tile_d", "sp", [-1, 1, 1, 1]], ["tile_y", "sp", [-1, 1, 7, 1]], ["tile_x", "sp", [-1, 1, 1, 7]], ["tile_rc", "sp", [-1, 4]], ["tile_rd", "sp", [-1, 1]], ["tile_ry", "sp", [-1, 3]], ["tile_rx", "sp", [-1, 3]], ["auto_unroll_max_step", "ot", 1500], ["unroll_explicit", "ot", 1]]}, "result": [[0.0005814991397590362], 0, 2.2836945056915283, 1626891049.9751377], "version": 0.2, "tvm_version": "0.8.dev0"}
{"input": ["cuda -keys=cuda,gpu -max_num_threads=1024 -model=unknown -thread_warp_size=32", "conv3d_ncdhw.cuda", [["TENSOR", [1, 2048, 1, 7, 7], "float32"], ["TENSOR", [512, 2048, 1, 1, 1], "float32"], [1, 1, 1], [0, 0, 0, 0, 0, 0], [1, 1, 1], "float32"], {}], "config": {"index": 226628, "code_hash": null, "entity": [["tile_f", "sp", [-1, 2, 8, 1]], ["tile_d", "sp", [-1, 1, 1, 1]], ["tile_y", "sp", [-1, 1, 7, 1]], ["tile_x", "sp", [-1, 7, 1, 1]], ["tile_rc", "sp", [-1, 16]], ["tile_rd", "sp", [-1, 1]], ["tile_ry", "sp", [-1, 1]], ["tile_rx", "sp", [-1, 1]], ["auto_unroll_max_step", "ot", 1500], ["unroll_explicit", "ot", 1]]}, "result": [[0.00010316207859888937], 0, 1.5652241706848145, 1626893510.688465], "version": 0.2, "tvm_version": "0.8.dev0"}
{"input": ["cuda -keys=cuda,gpu -max_num_threads=1024 -model=unknown -thread_warp_size=32", "conv3d_ncdhw_winograd.cuda", [["TENSOR", [1, 512, 1, 7, 7], "float32"], ["TENSOR", [512, 512, 3, 3, 3], "float32"], [1, 1, 1], [1, 1, 1, 1, 1, 1], [1, 1, 1], "float32"], {}], "config": {"index": 272603, "code_hash": null, "entity": [["tile_b", "sp", [-1, 1, 1, 1]], ["tile_y", "sp", [-1, 16, 4, 1]], ["tile_x", "sp", [-1, 1, 16, 1]], ["tile_rc", "sp", [-1, 32]], ["auto_unroll_max_step", "ot", 0], ["unroll_explicit", "ot", 1]]}, "result": [[0.00033740110986547086], 0, 2.5604734420776367, 1626895702.7466156], "version": 0.2, "tvm_version": "0.8.dev0"}
{"input": ["cuda -keys=cuda,gpu -max_num_threads=1024 -model=unknown -thread_warp_size=32", "conv3d_ncdhw.cuda", [["TENSOR", [1, 512, 1, 7, 7], "float32"], ["TENSOR", [512, 512, 3, 3, 3], "float32"], [1, 1, 1], [1, 1, 1, 1, 1, 1], [1, 1, 1], "float32"], {}], "config": {"index": 1350607, "code_hash": null, "entity": [["tile_f", "sp", [-1, 1, 8, 1]], ["tile_d", "sp", [-1, 1, 1, 1]], ["tile_y", "sp", [-1, 1, 1, 7]], ["tile_x", "sp", [-1, 1, 7, 1]], ["tile_rc", "sp", [-1, 8]], ["tile_rd", "sp", [-1, 1]], ["tile_ry", "sp", [-1, 3]], ["tile_rx", "sp", [-1, 3]], ["auto_unroll_max_step", "ot", 512], ["unroll_explicit", "ot", 1]]}, "result": [[0.00041811056944444436], 0, 1.7134041786193848, 1626898811.7213461], "version": 0.2, "tvm_version": "0.8.dev0"}
{"input": ["cuda -keys=cuda,gpu -max_num_threads=1024 -model=unknown -thread_warp_size=32", "conv3d_ncdhw.cuda", [["TENSOR", [1, 512, 1, 7, 7], "float32"], ["TENSOR", [2048, 512, 1, 1, 1], "float32"], [1, 1, 1], [0, 0, 0, 0, 0, 0], [1, 1, 1], "float32"], {}], "config": {"index": 312057, "code_hash": null, "entity": [["tile_f", "sp", [-1, 2, 8, 2]], ["tile_d", "sp", [-1, 1, 1, 1]], ["tile_y", "sp", [-1, 7, 1, 1]], ["tile_x", "sp", [-1, 1, 7, 1]], ["tile_rc", "sp", [-1, 8]], ["tile_rd", "sp", [-1, 1]], ["tile_ry", "sp", [-1, 1]], ["tile_rx", "sp", [-1, 1]], ["auto_unroll_max_step", "ot", 1500], ["unroll_explicit", "ot", 1]]}, "result": [[5.254589134720701e-05], 0, 1.547623634338379, 1626900637.2630572], "version": 0.2, "tvm_version": "0.8.dev0"}
{"input": ["cuda -keys=cuda,gpu -max_num_threads=1024 -model=unknown -thread_warp_size=32", "depthwise_conv2d_nchw.cuda", [["TENSOR", [1, 32, 56, 56], "float32"], ["TENSOR", [32, 1, 3, 3], "float32"], [1, 1], [1, 1, 1, 1], [1, 1], "float32"], {}], "config": {"index": 1996120, "code_hash": null, "entity": [["tile_f", "sp", [-1, 1, 1, 1]], ["tile_y", "sp", [-1, 1, 14, 2]], ["tile_x", "sp", [-1, 1, 14, 2]], ["auto_unroll_max_step", "ot", 1500], ["unroll_explicit", "ot", 1]]}, "result": [[3.2988153993814652e-06], 0, 1.4635841846466064, 1626769578.7176864], "version": 0.2, "tvm_version": "0.8.dev0"}
{"input": ["cuda -keys=cuda,gpu -max_num_threads=1024 -model=unknown -thread_warp_size=32", "conv2d_nchw.cuda", [["TENSOR", [1, 32, 56, 56], "float32"], ["TENSOR", [16, 32, 1, 1], "float32"], [1, 1], [0, 0, 0, 0], [1, 1], "float32"], {}], "config": {"index": 3043913, "code_hash": null, "entity": [["tile_f", "sp", [-1, 1, 2, 8]], ["tile_y", "sp", [-1, 1, 2, 1]], ["tile_x", "sp", [-1, 1, 28, 2]], ["tile_rc", "sp", [-1, 2]], ["tile_ry", "sp", [-1, 1]], ["tile_rx", "sp", [-1, 1]], ["auto_unroll_max_step", "ot", 1500], ["unroll_explicit", "ot", 0]]}, "result": [[3.1950177777777777e-06], 0, 1.431422233581543, 1626772425.6111925], "version": 0.2, "tvm_version": "0.8.dev0"}
{"input": ["cuda -keys=cuda,gpu -max_num_threads=1024 -model=unknown -thread_warp_size=32", "conv2d_nchw.cuda", [["TENSOR", [1, 16, 56, 56], "float32"], ["TENSOR", [96, 16, 1, 1], "float32"], [1, 1], [0, 0, 0, 0], [1, 1], "float32"], {}], "config": {"index": 39227276, "code_hash": null, "entity": [["tile_f", "sp", [-1, 2, 8, 6]], ["tile_y", "sp", [-1, 2, 1, 1]], ["tile_x", "sp", [-1, 1, 56, 1]], ["tile_rc", "sp", [-1, 4]], ["tile_ry", "sp", [-1, 1]], ["tile_rx", "sp", [-1, 1]], ["auto_unroll_max_step", "ot", 1500], ["unroll_explicit", "ot", 1]]}, "result": [[5.27457666989123e-06], 0, 1.7020528316497803, 1626774474.1420712], "version": 0.2, "tvm_version": "0.8.dev0"}
{"input": ["cuda -keys=cuda,gpu -max_num_threads=1024 -model=unknown -thread_warp_size=32", "depthwise_conv2d_nchw.cuda", [["TENSOR", [1, 96, 56, 56], "float32"], ["TENSOR", [96, 1, 3, 3], "float32"], [2, 2], [1, 1, 1, 1], [1, 1], "float32"], {}], "config": {"index": 1592640, "code_hash": null, "entity": [["tile_f", "sp", [-1, 1, 1, 1]], ["tile_y", "sp", [-1, 1, 1, 7]], ["tile_x", "sp", [-1, 1, 28, 1]], ["auto_unroll_max_step", "ot", 256], ["unroll_explicit", "ot", 1]]}, "result": [[3.858718777779715e-06], 0, 1.7286641597747803, 1626777204.2141488], "version": 0.2, "tvm_version": "0.8.dev0"}
{"input": ["cuda -keys=cuda,gpu -max_num_threads=1024 -model=unknown -thread_warp_size=32", "conv2d_nchw.cuda", [["TENSOR", [1, 96, 28, 28], "float32"], ["TENSOR", [24, 96, 1, 1], "float32"], [1, 1], [0, 0, 0, 0], [1, 1], "float32"], {}], "config": {"index": 8147226, "code_hash": null, "entity": [["tile_f", "sp", [-1, 3, 8, 1]], ["tile_y", "sp", [-1, 1, 1, 1]], ["tile_x", "sp", [-1, 1, 14, 2]], ["tile_rc", "sp", [-1, 4]], ["tile_ry", "sp", [-1, 1]], ["tile_rx", "sp", [-1, 1]], ["auto_unroll_max_step", "ot", 1500], ["unroll_explicit", "ot", 1]]}, "result": [[3.973299846845985e-06], 0, 1.6392226219177246, 1626779520.4976938], "version": 0.2, "tvm_version": "0.8.dev0"}
{"input": ["cuda -keys=cuda,gpu -max_num_threads=1024 -model=unknown -thread_warp_size=32", "depthwise_conv2d_nchw.cuda", [["TENSOR", [1, 144, 28, 28], "float32"], ["TENSOR", [144, 1, 3, 3], "float32"], [1, 1], [1, 1, 1, 1], [1, 1], "float32"], {}], "config": {"index": 3171000, "code_hash": null, "entity": [["tile_f", "sp", [-1, 1, 1, 1]], ["tile_y", "sp", [-1, 7, 1, 2]], ["tile_x", "sp", [-1, 1, 14, 2]], ["auto_unroll_max_step", "ot", 1500], ["unroll_explicit", "ot", 1]]}, "result": [[3.215656639168716e-06], 0, 1.387709379196167, 1626780685.18513], "version": 0.2, "tvm_version": "0.8.dev0"}
{"input": ["cuda -keys=cuda,gpu -max_num_threads=1024 -model=unknown -thread_warp_size=32", "conv2d_nchw.cuda", [["TENSOR", [1, 144, 28, 28], "float32"], ["TENSOR", [24, 144, 1, 1], "float32"], [1, 1], [0, 0, 0, 0], [1, 1], "float32"], {}], "config": {"index": 10323257, "code_hash": null, "entity": [["tile_f", "sp", [-1, 1, 8, 3]], ["tile_y", "sp", [-1, 1, 1, 1]], ["tile_x", "sp", [-1, 1, 14, 2]], ["tile_rc", "sp", [-1, 8]], ["tile_ry", "sp", [-1, 1]], ["tile_rx", "sp", [-1, 1]], ["auto_unroll_max_step", "ot", 1500], ["unroll_explicit", "ot", 1]]}, "result": [[4.967557862258953e-06], 0, 2.1486542224884033, 1626782049.1546593], "version": 0.2, "tvm_version": "0.8.dev0"}
{"input": ["cuda -keys=cuda,gpu -max_num_threads=1024 -model=unknown -thread_warp_size=32", "conv2d_nchw.cuda", [["TENSOR", [1, 24, 28, 28], "float32"], ["TENSOR", [144, 24, 1, 1], "float32"], [1, 1], [0, 0, 0, 0], [1, 1], "float32"], {}], "config": {"index": 7524591, "code_hash": null, "entity": [["tile_f", "sp", [-1, 1, 8, 9]], ["tile_y", "sp", [-1, 1, 1, 2]], ["tile_x", "sp", [-1, 1, 28, 1]], ["tile_rc", "sp", [-1, 8]], ["tile_ry", "sp", [-1, 1]], ["tile_rx", "sp", [-1, 1]], ["auto_unroll_max_step", "ot", 512], ["unroll_explicit", "ot", 0]]}, "result": [[3.574770866902997e-06], 0, 1.3514630794525146, 1626784041.2545114], "version": 0.2, "tvm_version": "0.8.dev0"}
{"input": ["cuda -keys=cuda,gpu -max_num_threads=1024 -model=unknown -thread_warp_size=32", "depthwise_conv2d_nchw.cuda", [["TENSOR", [1, 144, 28, 28], "float32"], ["TENSOR", [144, 1, 3, 3], "float32"], [2, 2], [1, 1, 1, 1], [1, 1], "float32"], {}], "config": {"index": 497350, "code_hash": null, "entity": [["tile_f", "sp", [-1, 1, 1, 1]], ["tile_y", "sp", [-1, 2, 1, 7]], ["tile_x", "sp", [-1, 1, 14, 1]], ["auto_unroll_max_step", "ot", 1500], ["unroll_explicit", "ot", 1]]}, "result": [[2.7705479902979906e-06], 0, 1.2624905109405518, 1626785336.1245892], "version": 0.2, "tvm_version": "0.8.dev0"}
{"input": ["cuda -keys=cuda,gpu -max_num_threads=1024 -model=unknown -thread_warp_size=32", "conv2d_nchw.cuda", [["TENSOR", [1, 144, 14, 14], "float32"], ["TENSOR", [32, 144, 1, 1], "float32"], [1, 1], [0, 0, 0, 0], [1, 1], "float32"], {}], "config": {"index": 293921, "code_hash": null, "entity": [["tile_f", "sp", [-1, 1, 8, 2]], ["tile_y", "sp", [-1, 1, 1, 1]], ["tile_x", "sp", [-1, 1, 14, 1]], ["tile_rc", "sp", [-1, 8]], ["tile_ry", "sp", [-1, 1]], ["tile_rx", "sp", [-1, 1]], ["auto_unroll_max_step", "ot", 512], ["unroll_explicit", "ot", 0]]}, "result": [[3.6683135837687107e-06], 0, 1.3844048976898193, 1626787258.416458], "version": 0.2, "tvm_version": "0.8.dev0"}
{"input": ["cuda -keys=cuda,gpu -max_num_threads=1024 -model=unknown -thread_warp_size=32", "depthwise_conv2d_nchw.cuda", [["TENSOR", [1, 192, 14, 14], "float32"], ["TENSOR", [192, 1, 3, 3], "float32"], [1, 1], [1, 1, 1, 1], [1, 1], "float32"], {}], "config": {"index": 61824, "code_hash": null, "entity": [["tile_f", "sp", [-1, 1, 1, 1]], ["tile_y", "sp", [-1, 1, 14, 1]], ["tile_x", "sp", [-1, 1, 7, 2]], ["auto_unroll_max_step", "ot", 0], ["unroll_explicit", "ot", 0]]}, "result": [[2.5817201403341854e-06], 0, 1.3784854412078857, 1626788796.6677954], "version": 0.2, "tvm_version": "0.8.dev0"}
{"input": ["cuda -keys=cuda,gpu -max_num_threads=1024 -model=unknown -thread_warp_size=32", "conv2d_nchw.cuda", [["TENSOR", [1, 192, 14, 14], "float32"], ["TENSOR", [32, 192, 1, 1], "float32"], [1, 1], [0, 0, 0, 0], [1, 1], "float32"], {}], "config": {"index": 308240, "code_hash": null, "entity": [["tile_f", "sp", [-1, 2, 8, 1]], ["tile_y", "sp", [-1, 1, 1, 1]], ["tile_x", "sp", [-1, 1, 14, 1]], ["tile_rc", "sp", [-1, 16]], ["tile_ry", "sp", [-1, 1]], ["tile_rx", "sp", [-1, 1]], ["auto_unroll_max_step", "ot", 512], ["unroll_explicit", "ot", 0]]}, "result": [[4.529490981841817e-06], 0, 1.706373691558838, 1626790313.6527674], "version": 0.2, "tvm_version": "0.8.dev0"}
{"input": ["cuda -keys=cuda,gpu -max_num_threads=1024 -model=unknown -thread_warp_size=32", "conv2d_nchw.cuda", [["TENSOR", [1, 32, 14, 14], "float32"], ["TENSOR", [192, 32, 1, 1], "float32"], [1, 1], [0, 0, 0, 0], [1, 1], "float32"], {}], "config": {"index": 2451958, "code_hash": null, "entity": [["tile_f", "sp", [-1, 2, 8, 3]], ["tile_y", "sp", [-1, 2, 1, 1]], ["tile_x", "sp", [-1, 1, 14, 1]], ["tile_rc", "sp", [-1, 16]], ["tile_ry", "sp", [-1, 1]], ["tile_rx", "sp", [-1, 1]], ["auto_unroll_max_step", "ot", 512], ["unroll_explicit", "ot", 1]]}, "result": [[2.840961273861274e-06], 0, 1.2444682121276855, 1626791894.1337864], "version": 0.2, "tvm_version": "0.8.dev0"}
{"input": ["cuda -keys=cuda,gpu -max_num_threads=1024 -model=unknown -thread_warp_size=32", "depthwise_conv2d_nchw.cuda", [["TENSOR", [1, 192, 14, 14], "float32"], ["TENSOR", [192, 1, 3, 3], "float32"], [2, 2], [1, 1, 1, 1], [1, 1], "float32"], {}], "config": {"index": 29904, "code_hash": null, "entity": [["tile_f", "sp", [-1, 1, 1, 1]], ["tile_y", "sp", [-1, 7, 1, 1]], ["tile_x", "sp", [-1, 1, 7, 1]], ["auto_unroll_max_step", "ot", 1500], ["unroll_explicit", "ot", 1]]}, "result": [[2.3266597366202638e-06], 0, 1.3522324562072754, 1626793204.2636414], "version": 0.2, "tvm_version": "0.8.dev0"}
{"input": ["cuda -keys=cuda,gpu -max_num_threads=1024 -model=unknown -thread_warp_size=32", "conv2d_nchw.cuda", [["TENSOR", [1, 192, 7, 7], "float32"], ["TENSOR", [64, 192, 1, 1], "float32"], [1, 1], [0, 0, 0, 0], [1, 1], "float32"], {}], "config": {"index": 26227, "code_hash": null, "entity": [["tile_f", "sp", [-1, 2, 8, 1]], ["tile_y", "sp", [-1, 1, 1, 1]], ["tile_x", "sp", [-1, 1, 7, 1]], ["tile_rc", "sp", [-1, 8]], ["tile_ry", "sp", [-1, 1]], ["tile_rx", "sp", [-1, 1]], ["auto_unroll_max_step", "ot", 512], ["unroll_explicit", "ot", 0]]}, "result": [[4.228003258099745e-06], 0, 1.3961050510406494, 1626794499.5188577], "version": 0.2, "tvm_version": "0.8.dev0"}
{"input": ["cuda -keys=cuda,gpu -max_num_threads=1024 -model=unknown -thread_warp_size=32", "conv2d_nchw.cuda", [["TENSOR", [1, 384, 7, 7], "float32"], ["TENSOR", [64, 384, 1, 1], "float32"], [1, 1], [0, 0, 0, 0], [1, 1], "float32"], {}], "config": {"index": 50419, "code_hash": null, "entity": [["tile_f", "sp", [-1, 2, 8, 1]], ["tile_y", "sp", [-1, 1, 1, 1]], ["tile_x", "sp", [-1, 1, 7, 1]], ["tile_rc", "sp", [-1, 8]], ["tile_ry", "sp", [-1, 1]], ["tile_rx", "sp", [-1, 1]], ["auto_unroll_max_step", "ot", 1500], ["unroll_explicit", "ot", 0]]}, "result": [[7.255943779265265e-06], 0, 1.6180460453033447, 1626795832.0919855], "version": 0.2, "tvm_version": "0.8.dev0"}
{"input": ["cuda -keys=cuda,gpu -max_num_threads=1024 -model=unknown -thread_warp_size=32", "conv2d_nchw.cuda", [["TENSOR", [1, 64, 7, 7], "float32"], ["TENSOR", [384, 64, 1, 1], "float32"], [1, 1], [0, 0, 0, 0], [1, 1], "float32"], {}], "config": {"index": 143248, "code_hash": null, "entity": [["tile_f", "sp", [-1, 2, 4, 3]], ["tile_y", "sp", [-1, 1, 7, 1]], ["tile_x", "sp", [-1, 1, 7, 1]], ["tile_rc", "sp", [-1, 16]], ["tile_ry", "sp", [-1, 1]], ["tile_rx", "sp", [-1, 1]], ["auto_unroll_max_step", "ot", 1500], ["unroll_explicit", "ot", 0]]}, "result": [[3.5480000772618402e-06], 0, 1.4126369953155518, 1626796996.4956167], "version": 0.2, "tvm_version": "0.8.dev0"}
{"input": ["cuda -keys=cuda,gpu -max_num_threads=1024 -model=unknown -thread_warp_size=32", "depthwise_conv2d_nchw.cuda", [["TENSOR", [1, 384, 7, 7], "float32"], ["TENSOR", [384, 1, 3, 3], "float32"], [1, 1], [1, 1, 1, 1], [1, 1], "float32"], {}], "config": {"index": 27840, "code_hash": null, "entity": [["tile_f", "sp", [-1, 1, 1, 1]], ["tile_y", "sp", [-1, 1, 7, 1]], ["tile_x", "sp", [-1, 1, 7, 1]], ["auto_unroll_max_step", "ot", 0], ["unroll_explicit", "ot", 1]]}, "result": [[2.29731376370029e-06], 0, 1.3405001163482666, 1626798180.6457932], "version": 0.2, "tvm_version": "0.8.dev0"}
{"input": ["cuda -keys=cuda,gpu -max_num_threads=1024 -model=unknown -thread_warp_size=32", "conv2d_nchw.cuda", [["TENSOR", [1, 384, 7, 7], "float32"], ["TENSOR", [96, 384, 1, 1], "float32"], [1, 1], [0, 0, 0, 0], [1, 1], "float32"], {}], "config": {"index": 317284, "code_hash": null, "entity": [["tile_f", "sp", [-1, 1, 12, 2]], ["tile_y", "sp", [-1, 1, 1, 1]], ["tile_x", "sp", [-1, 1, 7, 1]], ["tile_rc", "sp", [-1, 24]], ["tile_ry", "sp", [-1, 1]], ["tile_rx", "sp", [-1, 1]], ["auto_unroll_max_step", "ot", 1500], ["unroll_explicit", "ot", 1]]}, "result": [[9.27706182208272e-06], 0, 2.0071144104003906, 1626799349.664607], "version": 0.2, "tvm_version": "0.8.dev0"}
{"input": ["cuda -keys=cuda,gpu -max_num_threads=1024 -model=unknown -thread_warp_size=32", "depthwise_conv2d_nchw.cuda", [["TENSOR", [1, 576, 7, 7], "float32"], ["TENSOR", [576, 1, 3, 3], "float32"], [1, 1], [1, 1, 1, 1], [1, 1], "float32"], {}], "config": {"index": 35372, "code_hash": null, "entity": [["tile_f", "sp", [-1, 1, 9, 1]], ["tile_y", "sp", [-1, 1, 7, 1]], ["tile_x", "sp", [-1, 1, 7, 1]], ["auto_unroll_max_step", "ot", 1500], ["unroll_explicit", "ot", 0]]}, "result": [[2.4316008144427856e-06], 0, 1.1799194812774658, 1626800779.530363], "version": 0.2, "tvm_version": "0.8.dev0"}
{"input": ["cuda -keys=cuda,gpu -max_num_threads=1024 -model=unknown -thread_warp_size=32", "conv2d_nchw.cuda", [["TENSOR", [1, 576, 7, 7], "float32"], ["TENSOR", [96, 576, 1, 1], "float32"], [1, 1], [0, 0, 0, 0], [1, 1], "float32"], {}], "config": {"index": 412708, "code_hash": null, "entity": [["tile_f", "sp", [-1, 1, 12, 2]], ["tile_y", "sp", [-1, 1, 7, 1]], ["tile_x", "sp", [-1, 1, 1, 1]], ["tile_rc", "sp", [-1, 24]], ["tile_ry", "sp", [-1, 1]], ["tile_rx", "sp", [-1, 1]], ["auto_unroll_max_step", "ot", 1500], ["unroll_explicit", "ot", 1]]}, "result": [[1.3150418514350028e-05], 0, 2.721120595932007, 1626802109.0108218], "version": 0.2, "tvm_version": "0.8.dev0"}
{"input": ["cuda -keys=cuda,gpu -max_num_threads=1024 -model=unknown -thread_warp_size=32", "conv2d_nchw.cuda", [["TENSOR", [1, 96, 7, 7], "float32"], ["TENSOR", [576, 96, 1, 1], "float32"], [1, 1], [0, 0, 0, 0], [1, 1], "float32"], {}], "config": {"index": 438536, "code_hash": null, "entity": [["tile_f", "sp", [-1, 4, 4, 1]], ["tile_y", "sp", [-1, 1, 7, 1]], ["tile_x", "sp", [-1, 1, 7, 1]], ["tile_rc", "sp", [-1, 24]], ["tile_ry", "sp", [-1, 1]], ["tile_rx", "sp", [-1, 1]], ["auto_unroll_max_step", "ot", 1500], ["unroll_explicit", "ot", 0]]}, "result": [[5.579141346935758e-06], 0, 1.63499116897583, 1626803278.820766], "version": 0.2, "tvm_version": "0.8.dev0"}
{"input": ["cuda -keys=cuda,gpu -max_num_threads=1024 -model=unknown -thread_warp_size=32", "depthwise_conv2d_nchw.cuda", [["TENSOR", [1, 576, 7, 7], "float32"], ["TENSOR", [576, 1, 3, 3], "float32"], [2, 2], [1, 1, 1, 1], [1, 1], "float32"], {}], "config": {"index": 214292, "code_hash": null, "entity": [["tile_f", "sp", [-1, 1, 9, 1]], ["tile_y", "sp", [-1, 1, 4, 1]], ["tile_x", "sp", [-1, 1, 4, 1]], ["auto_unroll_max_step", "ot", 1500], ["unroll_explicit", "ot", 0]]}, "result": [[2.4418611528688686e-06], 0, 1.3576724529266357, 1626804782.4302623], "version": 0.2, "tvm_version": "0.8.dev0"}
{"input": ["cuda -keys=cuda,gpu -max_num_threads=1024 -model=unknown -thread_warp_size=32", "conv2d_nchw.cuda", [["TENSOR", [1, 576, 4, 4], "float32"], ["TENSOR", [160, 576, 1, 1], "float32"], [1, 1], [0, 0, 0, 0], [1, 1], "float32"], {}], "config": {"index": 2595082, "code_hash": null, "entity": [["tile_f", "sp", [-1, 1, 10, 1]], ["tile_y", "sp", [-1, 1, 4, 1]], ["tile_x", "sp", [-1, 1, 2, 2]], ["tile_rc", "sp", [-1, 24]], ["tile_ry", "sp", [-1, 1]], ["tile_rx", "sp", [-1, 1]], ["auto_unroll_max_step", "ot", 1500], ["unroll_explicit", "ot", 1]]}, "result": [[6.215395161731706e-06], 0, 2.7732348442077637, 1626806037.3934283], "version": 0.2, "tvm_version": "0.8.dev0"}
{"input": ["cuda -keys=cuda,gpu -max_num_threads=1024 -model=unknown -thread_warp_size=32", "conv2d_nchw.cuda", [["TENSOR", [1, 960, 4, 4], "float32"], ["TENSOR", [160, 960, 1, 1], "float32"], [1, 1], [0, 0, 0, 0], [1, 1], "float32"], {}], "config": {"index": 1557950, "code_hash": null, "entity": [["tile_f", "sp", [-1, 1, 5, 1]], ["tile_y", "sp", [-1, 1, 4, 1]], ["tile_x", "sp", [-1, 1, 4, 1]], ["tile_rc", "sp", [-1, 30]], ["tile_ry", "sp", [-1, 1]], ["tile_rx", "sp", [-1, 1]], ["auto_unroll_max_step", "ot", 1500], ["unroll_explicit", "ot", 0]]}, "result": [[1.0170223266180133e-05], 0, 1.9033658504486084, 1626807802.0254574], "version": 0.2, "tvm_version": "0.8.dev0"}
{"input": ["cuda -keys=cuda,gpu -max_num_threads=1024 -model=unknown -thread_warp_size=32", "conv2d_nchw.cuda", [["TENSOR", [1, 160, 4, 4], "float32"], ["TENSOR", [960, 160, 1, 1], "float32"], [1, 1], [0, 0, 0, 0], [1, 1], "float32"], {}], "config": {"index": 8945023, "code_hash": null, "entity": [["tile_f", "sp", [-1, 1, 6, 5]], ["tile_y", "sp", [-1, 1, 4, 1]], ["tile_x", "sp", [-1, 1, 4, 1]], ["tile_rc", "sp", [-1, 16]], ["tile_ry", "sp", [-1, 1]], ["tile_rx", "sp", [-1, 1]], ["auto_unroll_max_step", "ot", 1500], ["unroll_explicit", "ot", 1]]}, "result": [[5.194692272053373e-06], 0, 1.922018051147461, 1626809246.167473], "version": 0.2, "tvm_version": "0.8.dev0"}
{"input": ["cuda -keys=cuda,gpu -max_num_threads=1024 -model=unknown -thread_warp_size=32", "depthwise_conv2d_nchw.cuda", [["TENSOR", [1, 960, 4, 4], "float32"], ["TENSOR", [960, 1, 3, 3], "float32"], [1, 1], [1, 1, 1, 1], [1, 1], "float32"], {}], "config": {"index": 518999, "code_hash": null, "entity": [["tile_f", "sp", [-1, 1, 60, 1]], ["tile_y", "sp", [-1, 1, 1, 2]], ["tile_x", "sp", [-1, 1, 2, 2]], ["auto_unroll_max_step", "ot", 0], ["unroll_explicit", "ot", 1]]}, "result": [[2.251736003281282e-06], 0, 1.476783275604248, 1626811876.7634873], "version": 0.2, "tvm_version": "0.8.dev0"}
{"input": ["cuda -keys=cuda,gpu -max_num_threads=1024 -model=unknown -thread_warp_size=32", "conv2d_nchw.cuda", [["TENSOR", [1, 960, 4, 4], "float32"], ["TENSOR", [320, 960, 1, 1], "float32"], [1, 1], [0, 0, 0, 0], [1, 1], "float32"], {}], "config": {"index": 5260131, "code_hash": null, "entity": [["tile_f", "sp", [-1, 1, 10, 1]], ["tile_y", "sp", [-1, 1, 4, 1]], ["tile_x", "sp", [-1, 1, 4, 1]], ["tile_rc", "sp", [-1, 48]], ["tile_ry", "sp", [-1, 1]], ["tile_rx", "sp", [-1, 1]], ["auto_unroll_max_step", "ot", 1500], ["unroll_explicit", "ot", 1]]}, "result": [[1.3587023351251372e-05], 0, 2.318250894546509, 1626813855.6222765], "version": 0.2, "tvm_version": "0.8.dev0"}
{"input": ["cuda -keys=cuda,gpu -max_num_threads=1024 -model=unknown -thread_warp_size=32", "conv2d_nchw.cuda", [["TENSOR", [1, 320, 4, 4], "float32"], ["TENSOR", [1280, 320, 1, 1], "float32"], [1, 1], [0, 0, 0, 0], [1, 1], "float32"], {}], "config": {"index": 4940188, "code_hash": null, "entity": [["tile_f", "sp", [-1, 2, 20, 1]], ["tile_y", "sp", [-1, 1, 4, 1]], ["tile_x", "sp", [-1, 1, 2, 2]], ["tile_rc", "sp", [-1, 8]], ["tile_ry", "sp", [-1, 1]], ["tile_rx", "sp", [-1, 1]], ["auto_unroll_max_step", "ot", 1500], ["unroll_explicit", "ot", 1]]}, "result": [[1.1099461440075793e-05], 0, 2.6038742065429688, 1626815433.207924], "version": 0.2, "tvm_version": "0.8.dev0"}
{"input": ["cuda -keys=cuda,gpu -max_num_threads=1024 -model=unknown -thread_warp_size=32", "dense_small_batch.cuda", [["TENSOR", [1, 2560], "float32"], ["TENSOR", [2560, 2560], "float32"], null, "float32"], {}], "config": {"index": 14, "code_hash": null, "entity": [["tile_k", "sp", [-1, 256]]]}, "result": [[6.374009691861996e-05], 0, 2.0768020153045654, 1626541706.3913715], "version": 0.2, "tvm_version": "0.8.dev0"}
{"input": ["cuda -keys=cuda,gpu -max_num_threads=1024 -model=unknown -thread_warp_size=32", "depthwise_conv2d_nchw.cuda", [["TENSOR", [1, 256, 28, 28], "float32"], ["TENSOR", [256, 1, 5, 5], "float32"], [2, 2], [2, 2, 2, 2], [1, 1], "float32"], {}], "config": {"index": 200310, "code_hash": null, "entity": [["tile_f", "sp", [-1, 1, 1, 1]], ["tile_y", "sp", [-1, 1, 2, 7]], ["tile_x", "sp", [-1, 1, 7, 2]], ["auto_unroll_max_step", "ot", 256], ["unroll_explicit", "ot", 1]]}, "result": [[4.185833797679955e-06], 0, 1.6284289360046387, 1626515908.8952615], "version": 0.2, "tvm_version": "0.8.dev0"}
{"input": ["cuda -keys=cuda,gpu -max_num_threads=1024 -model=unknown -thread_warp_size=32", "depthwise_conv2d_nchw.cuda", [["TENSOR", [1, 128, 56, 56], "float32"], ["TENSOR", [128, 1, 5, 5], "float32"], [2, 2], [2, 2, 2, 2], [1, 1], "float32"], {}], "config": {"index": 1045920, "code_hash": null, "entity": [["tile_f", "sp", [-1, 1, 1, 1]], ["tile_y", "sp", [-1, 1, 1, 14]], ["tile_x", "sp", [-1, 1, 28, 1]], ["auto_unroll_max_step", "ot", 1500], ["unroll_explicit", "ot", 1]]}, "result": [[5.73234189808369e-06], 0, 1.661818265914917, 1626517135.0601795], "version": 0.2, "tvm_version": "0.8.dev0"}
{"input": ["cuda -keys=cuda,gpu -max_num_threads=1024 -model=unknown -thread_warp_size=32", "conv2d_nchw.cuda", [["TENSOR", [1, 320, 56, 56], "float32"], ["TENSOR", [64, 320, 1, 1], "float32"], [1, 1], [0, 0, 0, 0], [1, 1], "float32"], {}], "config": {"index": 40052484, "code_hash": null, "entity": [["tile_f", "sp", [-1, 4, 16, 1]], ["tile_y", "sp", [-1, 2, 4, 1]], ["tile_x", "sp", [-1, 1, 4, 2]], ["tile_rc", "sp", [-1, 8]], ["tile_ry", "sp", [-1, 1]], ["tile_rx", "sp", [-1, 1]], ["auto_unroll_max_step", "ot", 1500], ["unroll_explicit", "ot", 1]]}, "result": [[4.61615570688663e-05], 0, 1.7532734870910645, 1626521257.6505392], "version": 0.2, "tvm_version": "0.8.dev0"}
{"input": ["cuda -keys=cuda,gpu -max_num_threads=1024 -model=unknown -thread_warp_size=32", "depthwise_conv2d_nchw.cuda", [["TENSOR", [1, 64, 56, 56], "float32"], ["TENSOR", [64, 1, 3, 3], "float32"], [1, 1], [1, 1, 1, 1], [1, 1], "float32"], {}], "config": {"index": 3008040, "code_hash": null, "entity": [["tile_f", "sp", [-1, 1, 1, 1]], ["tile_y", "sp", [-1, 7, 1, 4]], ["tile_x", "sp", [-1, 1, 28, 2]], ["auto_unroll_max_step", "ot", 1500], ["unroll_explicit", "ot", 1]]}, "result": [[3.999880474981871e-06], 0, 1.9575583934783936, 1626522787.6370182], "version": 0.2, "tvm_version": "0.8.dev0"}
{"input": ["cuda -keys=cuda,gpu -max_num_threads=1024 -model=unknown -thread_warp_size=32", "conv2d_nchw.cuda", [["TENSOR", [1, 320, 56, 56], "float32"], ["TENSOR", [128, 320, 1, 1], "float32"], [1, 1], [0, 0, 0, 0], [1, 1], "float32"], {}], "config": {"index": 12501056, "code_hash": null, "entity": [["tile_f", "sp", [-1, 4, 8, 2]], ["tile_y", "sp", [-1, 2, 4, 1]], ["tile_x", "sp", [-1, 1, 8, 1]], ["tile_rc", "sp", [-1, 4]], ["tile_ry", "sp", [-1, 1]], ["tile_rx", "sp", [-1, 1]], ["auto_unroll_max_step", "ot", 512], ["unroll_explicit", "ot", 0]]}, "result": [[8.329234164934165e-05], 0, 1.78248929977417, 1626525944.8992922], "version": 0.2, "tvm_version": "0.8.dev0"}
{"input": ["cuda -keys=cuda,gpu -max_num_threads=1024 -model=unknown -thread_warp_size=32", "depthwise_conv2d_nchw.cuda", [["TENSOR", [1, 128, 56, 56], "float32"], ["TENSOR", [128, 1, 7, 7], "float32"], [2, 2], [3, 3, 3, 3], [1, 1], "float32"], {}], "config": {"index": 1042200, "code_hash": null, "entity": [["tile_f", "sp", [-1, 1, 1, 1]], ["tile_y", "sp", [-1, 28, 1, 1]], ["tile_x", "sp", [-1, 1, 28, 1]], ["auto_unroll_max_step", "ot", 1500], ["unroll_explicit", "ot", 1]]}, "result": [[6.4819309964664305e-06], 0, 3.8896474838256836, 1626527300.4217412], "version": 0.2, "tvm_version": "0.8.dev0"}
{"input": ["cuda -keys=cuda,gpu -max_num_threads=1024 -model=unknown -thread_warp_size=32", "conv2d_nchw.cuda", [["TENSOR", [1, 640, 28, 28], "float32"], ["TENSOR", [128, 640, 1, 1], "float32"], [1, 1], [0, 0, 0, 0], [1, 1], "float32"], {}], "config": {"index": 16831019, "code_hash": null, "entity": [["tile_f", "sp", [-1, 2, 16, 2]], ["tile_y", "sp", [-1, 1, 1, 2]], ["tile_x", "sp", [-1, 1, 14, 2]], ["tile_rc", "sp", [-1, 20]], ["tile_ry", "sp", [-1, 1]], ["tile_rx", "sp", [-1, 1]], ["auto_unroll_max_step", "ot", 1500], ["unroll_explicit", "ot", 1]]}, "result": [[5.453021875706215e-05], 0, 1.9410977363586426, 1626529335.4193904], "version": 0.2, "tvm_version": "0.8.dev0"}
{"input": ["cuda -keys=cuda,gpu -max_num_threads=1024 -model=unknown -thread_warp_size=32", "depthwise_conv2d_nchw.cuda", [["TENSOR", [1, 128, 28, 28], "float32"], ["TENSOR", [128, 1, 3, 3], "float32"], [1, 1], [1, 1, 1, 1], [1, 1], "float32"], {}], "config": {"index": 1089120, "code_hash": null, "entity": [["tile_f", "sp", [-1, 1, 1, 1]], ["tile_y", "sp", [-1, 1, 1, 14]], ["tile_x", "sp", [-1, 1, 14, 2]], ["auto_unroll_max_step", "ot", 1500], ["unroll_explicit", "ot", 1]]}, "result": [[3.1647180117820322e-06], 0, 1.5100455284118652, 1626530594.9945421], "version": 0.2, "tvm_version": "0.8.dev0"}
{"input": ["cuda -keys=cuda,gpu -max_num_threads=1024 -model=unknown -thread_warp_size=32", "conv2d_nchw.cuda", [["TENSOR", [1, 128, 28, 28], "float32"], ["TENSOR", [128, 128, 1, 1], "float32"], [1, 1], [0, 0, 0, 0], [1, 1], "float32"], {}], "config": {"index": 3921748, "code_hash": null, "entity": [["tile_f", "sp", [-1, 4, 16, 1]], ["tile_y", "sp", [-1, 2, 1, 1]], ["tile_x", "sp", [-1, 1, 28, 1]], ["tile_rc", "sp", [-1, 16]], ["tile_ry", "sp", [-1, 1]], ["tile_rx", "sp", [-1, 1]], ["auto_unroll_max_step", "ot", 1500], ["unroll_explicit", "ot", 0]]}, "result": [[1.2348334075133789e-05], 0, 1.801476001739502, 1626531725.3135374], "version": 0.2, "tvm_version": "0.8.dev0"}
{"input": ["cuda -keys=cuda,gpu -max_num_threads=1024 -model=unknown -thread_warp_size=32", "conv2d_nchw.cuda", [["TENSOR", [1, 640, 28, 28], "float32"], ["TENSOR", [256, 640, 1, 1], "float32"], [1, 1], [0, 0, 0, 0], [1, 1], "float32"], {}], "config": {"index": 22552630, "code_hash": null, "entity": [["tile_f", "sp", [-1, 2, 8, 4]], ["tile_y", "sp", [-1, 4, 1, 1]], ["tile_x", "sp", [-1, 1, 28, 1]], ["tile_rc", "sp", [-1, 10]], ["tile_ry", "sp", [-1, 1]], ["tile_rx", "sp", [-1, 1]], ["auto_unroll_max_step", "ot", 1500], ["unroll_explicit", "ot", 1]]}, "result": [[8.308724976481656e-05], 0, 1.7175872325897217, 1626533155.0180519], "version": 0.2, "tvm_version": "0.8.dev0"}
{"input": ["cuda -keys=cuda,gpu -max_num_threads=1024 -model=unknown -thread_warp_size=32", "depthwise_conv2d_nchw.cuda", [["TENSOR", [1, 256, 28, 28], "float32"], ["TENSOR", [256, 1, 7, 7], "float32"], [2, 2], [3, 3, 3, 3], [1, 1], "float32"], {}], "config": {"index": 234804, "code_hash": null, "entity": [["tile_f", "sp", [-1, 1, 2, 1]], ["tile_y", "sp", [-1, 1, 1, 14]], ["tile_x", "sp", [-1, 1, 14, 1]], ["auto_unroll_max_step", "ot", 1500], ["unroll_explicit", "ot", 1]]}, "result": [[4.639461627296589e-06], 0, 2.0238490104675293, 1626534389.637833], "version": 0.2, "tvm_version": "0.8.dev0"}
{"input": ["cuda -keys=cuda,gpu -max_num_threads=1024 -model=unknown -thread_warp_size=32", "conv2d_nchw.cuda", [["TENSOR", [1, 1280, 14, 14], "float32"], ["TENSOR", [256, 1280, 1, 1], "float32"], [1, 1], [0, 0, 0, 0], [1, 1], "float32"], {}], "config": {"index": 241291, "code_hash": null, "entity": [["tile_f", "sp", [-1, 2, 4, 2]], ["tile_y", "sp", [-1, 1, 7, 1]], ["tile_x", "sp", [-1, 1, 7, 2]], ["tile_rc", "sp", [-1, 10]], ["tile_ry", "sp", [-1, 1]], ["tile_rx", "sp", [-1, 1]], ["auto_unroll_max_step", "ot", 0], ["unroll_explicit", "ot", 0]]}, "result": [[8.032929543378995e-05], 0, 1.4633431434631348, 1626536337.984998], "version": 0.2, "tvm_version": "0.8.dev0"}
{"input": ["cuda -keys=cuda,gpu -max_num_threads=1024 -model=unknown -thread_warp_size=32", "depthwise_conv2d_nchw.cuda", [["TENSOR", [1, 256, 14, 14], "float32"], ["TENSOR", [256, 1, 3, 3], "float32"], [1, 1], [1, 1, 1, 1], [1, 1], "float32"], {}], "config": {"index": 30360, "code_hash": null, "entity": [["tile_f", "sp", [-1, 1, 1, 1]], ["tile_y", "sp", [-1, 1, 14, 1]], ["tile_x", "sp", [-1, 1, 7, 2]], ["auto_unroll_max_step", "ot", 0], ["unroll_explicit", "ot", 0]]}, "result": [[2.8078965810400753e-06], 0, 1.3973054885864258, 1626537853.1437416], "version": 0.2, "tvm_version": "0.8.dev0"}
{"input": ["cuda -keys=cuda,gpu -max_num_threads=1024 -model=unknown -thread_warp_size=32", "conv2d_nchw.cuda", [["TENSOR", [1, 256, 14, 14], "float32"], ["TENSOR", [256, 256, 1, 1], "float32"], [1, 1], [0, 0, 0, 0], [1, 1], "float32"], {}], "config": {"index": 950597, "code_hash": null, "entity": [["tile_f", "sp", [-1, 4, 16, 1]], ["tile_y", "sp", [-1, 2, 1, 1]], ["tile_x", "sp", [-1, 1, 14, 1]], ["tile_rc", "sp", [-1, 16]], ["tile_ry", "sp", [-1, 1]], ["tile_rx", "sp", [-1, 1]], ["auto_unroll_max_step", "ot", 1500], ["unroll_explicit", "ot", 0]]}, "result": [[1.7479116116704637e-05], 0, 1.691641092300415, 1626540606.016297], "version": 0.2, "tvm_version": "0.8.dev0"}
{"input": ["cuda -keys=cuda,gpu -max_num_threads=1024 -model=unknown -thread_warp_size=32", "conv2d_nchw.cuda", [["TENSOR", [1, 1024, 14, 14], "float32"], ["TENSOR", [2048, 1024, 1, 1], "float32"], [2, 2], [0, 0, 0, 0], [1, 1], "float32"], {}], "config": {"index": 277121, "code_hash": null, "entity": [["tile_f", "sp", [-1, 2, 16, 2]], ["tile_y", "sp", [-1, 7, 1, 1]], ["tile_x", "sp", [-1, 1, 7, 1]], ["tile_rc", "sp", [-1, 8]], ["tile_ry", "sp", [-1, 1]], ["tile_rx", "sp", [-1, 1]], ["auto_unroll_max_step", "ot", 512], ["unroll_explicit", "ot", 1]]}, "result": [[0.00015003344237918216], 0, 1.7113430500030518, 1626470809.226165], "version": 0.2, "tvm_version": "0.8.dev0"}
{"input": ["cuda -keys=cuda,gpu -max_num_threads=1024 -model=unknown -thread_warp_size=32", "conv2d_nchw.cuda", [["TENSOR", [1, 512, 28, 28], "float32"], ["TENSOR", [1024, 512, 1, 1], "float32"], [2, 2], [0, 0, 0, 0], [1, 1], "float32"], {}], "config": {"index": 250643, "code_hash": null, "entity": [["tile_f", "sp", [-1, 2, 32, 2]], ["tile_y", "sp", [-1, 1, 1, 7]], ["tile_x", "sp", [-1, 1, 7, 1]], ["tile_rc", "sp", [-1, 8]], ["tile_ry", "sp", [-1, 1]], ["tile_rx", "sp", [-1, 1]], ["auto_unroll_max_step", "ot", 0], ["unroll_explicit", "ot", 0]]}, "result": [[0.00010702850419796729], 0, 1.5186004638671875, 1626472148.397674], "version": 0.2, "tvm_version": "0.8.dev0"}
{"input": ["cuda -keys=cuda,gpu -max_num_threads=1024 -model=unknown -thread_warp_size=32", "conv2d_nchw.cuda", [["TENSOR", [1, 256, 56, 56], "float32"], ["TENSOR", [512, 256, 1, 1], "float32"], [2, 2], [0, 0, 0, 0], [1, 1], "float32"], {}], "config": {"index": 4368803, "code_hash": null, "entity": [["tile_f", "sp", [-1, 8, 32, 1]], ["tile_y", "sp", [-1, 1, 1, 2]], ["tile_x", "sp", [-1, 2, 14, 1]], ["tile_rc", "sp", [-1, 8]], ["tile_ry", "sp", [-1, 1]], ["tile_rx", "sp", [-1, 1]], ["auto_unroll_max_step", "ot", 512], ["unroll_explicit", "ot", 0]]}, "result": [[7.884162741882585e-05], 0, 1.5464751720428467, 1626473703.1424558], "version": 0.2, "tvm_version": "0.8.dev0"}
{"input": ["cuda -keys=cuda,gpu -max_num_threads=1024 -model=unknown -thread_warp_size=32", "conv2d_nchw.cuda", [["TENSOR", [1, 64, 56, 56], "float32"], ["TENSOR", [256, 64, 1, 1], "float32"], [1, 1], [0, 0, 0, 0], [1, 1], "float32"], {}], "config": {"index": 41540968, "code_hash": null, "entity": [["tile_f", "sp", [-1, 4, 16, 2]], ["tile_y", "sp", [-1, 7, 1, 1]], ["tile_x", "sp", [-1, 1, 28, 1]], ["tile_rc", "sp", [-1, 16]], ["tile_ry", "sp", [-1, 1]], ["tile_rx", "sp", [-1, 1]], ["auto_unroll_max_step", "ot", 1500], ["unroll_explicit", "ot", 1]]}, "result": [[2.9191687721009632e-05], 0, 2.131074905395508, 1626475636.8272593], "version": 0.2, "tvm_version": "0.8.dev0"}
{"input": ["cuda -keys=cuda,gpu -max_num_threads=1024 -model=unknown -thread_warp_size=32", "conv2d_nchw.cuda", [["TENSOR", [1, 64, 56, 56], "float32"], ["TENSOR", [128, 64, 1, 1], "float32"], [1, 1], [0, 0, 0, 0], [1, 1], "float32"], {}], "config": {"index": 14096429, "code_hash": null, "entity": [["tile_f", "sp", [-1, 8, 16, 1]], ["tile_y", "sp", [-1, 1, 1, 2]], ["tile_x", "sp", [-1, 2, 28, 1]], ["tile_rc", "sp", [-1, 16]], ["tile_ry", "sp", [-1, 1]], ["tile_rx", "sp", [-1, 1]], ["auto_unroll_max_step", "ot", 1500], ["unroll_explicit", "ot", 0]]}, "result": [[1.758993912165573e-05], 0, 1.4738445281982422, 1626478044.7523654], "version": 0.2, "tvm_version": "0.8.dev0"}
{"input": ["cuda -keys=cuda,gpu -max_num_threads=1024 -model=unknown -thread_warp_size=32", "conv2d_nchw.cuda", [["TENSOR", [1, 256, 56, 56], "float32"], ["TENSOR", [128, 256, 1, 1], "float32"], [1, 1], [0, 0, 0, 0], [1, 1], "float32"], {}], "config": {"index": 17168429, "code_hash": null, "entity": [["tile_f", "sp", [-1, 8, 16, 1]], ["tile_y", "sp", [-1, 1, 1, 2]], ["tile_x", "sp", [-1, 2, 28, 1]], ["tile_rc", "sp", [-1, 16]], ["tile_ry", "sp", [-1, 1]], ["tile_rx", "sp", [-1, 1]], ["auto_unroll_max_step", "ot", 1500], ["unroll_explicit", "ot", 0]]}, "result": [[6.095913381245722e-05], 0, 1.447305679321289, 1626479859.5575686], "version": 0.2, "tvm_version": "0.8.dev0"}
{"input": ["cuda -keys=cuda,gpu -max_num_threads=1024 -model=unknown -thread_warp_size=32", "group_conv2d_nchw.cuda", [["TENSOR", [1, 128, 56, 56], "float32"], ["TENSOR", [128, 4, 3, 3], "float32"], [1, 1], [1, 1, 1, 1], [1, 1], 32, "float32"], {}], "config": {"index": 25486722, "code_hash": null, "entity": [["tile_n", "sp", [-1, 1, 1, 1]], ["tile_g", "sp", [-1, 1]], ["tile_f", "sp", [-1, 2, 1, 2]], ["tile_y", "sp", [-1, 2, 1, 7]], ["tile_x", "sp", [-1, 1, 56, 1]], ["tile_rc", "sp", [-1, 1]], ["tile_ry", "sp", [-1, 1]], ["tile_rx", "sp", [-1, 3]], ["auto_unroll_max_step", "ot", 1500], ["unroll_explicit", "ot", 1], ["fuse_yx", "ot", 0]]}, "result": [[1.0193841863041719e-05], 0, 2.0286900997161865, 1626484440.8144681], "version": 0.2, "tvm_version": "0.8.dev0"}
{"input": ["cuda -keys=cuda,gpu -max_num_threads=1024 -model=unknown -thread_warp_size=32", "conv2d_nchw.cuda", [["TENSOR", [1, 128, 56, 56], "float32"], ["TENSOR", [256, 128, 1, 1], "float32"], [1, 1], [0, 0, 0, 0], [1, 1], "float32"], {}], "config": {"index": 46820968, "code_hash": null, "entity": [["tile_f", "sp", [-1, 4, 16, 2]], ["tile_y", "sp", [-1, 7, 1, 1]], ["tile_x", "sp", [-1, 1, 28, 1]], ["tile_rc", "sp", [-1, 16]], ["tile_ry", "sp", [-1, 1]], ["tile_rx", "sp", [-1, 1]], ["auto_unroll_max_step", "ot", 1500], ["unroll_explicit", "ot", 1]]}, "result": [[5.22145414040426e-05], 0, 2.1269748210906982, 1626486053.71937], "version": 0.2, "tvm_version": "0.8.dev0"}
{"input": ["cuda -keys=cuda,gpu -max_num_threads=1024 -model=unknown -thread_warp_size=32", "conv2d_nchw.cuda", [["TENSOR", [1, 256, 56, 56], "float32"], ["TENSOR", [256, 256, 1, 1], "float32"], [1, 1], [0, 0, 0, 0], [1, 1], "float32"], {}], "config": {"index": 23588968, "code_hash": null, "entity": [["tile_f", "sp", [-1, 4, 16, 2]], ["tile_y", "sp", [-1, 7, 1, 1]], ["tile_x", "sp", [-1, 1, 28, 1]], ["tile_rc", "sp", [-1, 16]], ["tile_ry", "sp", [-1, 1]], ["tile_rx", "sp", [-1, 1]], ["auto_unroll_max_step", "ot", 1500], ["unroll_explicit", "ot", 0]]}, "result": [[9.72684414595028e-05], 0, 1.8680100440979004, 1626487456.393536], "version": 0.2, "tvm_version": "0.8.dev0"}
{"input": ["cuda -keys=cuda,gpu -max_num_threads=1024 -model=unknown -thread_warp_size=32", "group_conv2d_nchw.cuda", [["TENSOR", [1, 256, 56, 56], "float32"], ["TENSOR", [256, 8, 3, 3], "float32"], [2, 2], [1, 1, 1, 1], [1, 1], 32, "float32"], {}], "config": {"index": 33108954, "code_hash": null, "entity": [["tile_n", "sp", [-1, 1, 1, 1]], ["tile_g", "sp", [-1, 1]], ["tile_f", "sp", [-1, 1, 1, 8]], ["tile_y", "sp", [-1, 1, 1, 4]], ["tile_x", "sp", [-1, 1, 28, 1]], ["tile_rc", "sp", [-1, 1]], ["tile_ry", "sp", [-1, 3]], ["tile_rx", "sp", [-1, 3]], ["auto_unroll_max_step", "ot", 512], ["unroll_explicit", "ot", 1], ["fuse_yx", "ot", 1]]}, "result": [[1.1969048984951015e-05], 0, 1.5389044284820557, 1626490797.8339887], "version": 0.2, "tvm_version": "0.8.dev0"}
{"input": ["cuda -keys=cuda,gpu -max_num_threads=1024 -model=unknown -thread_warp_size=32", "conv2d_nchw.cuda", [["TENSOR", [1, 512, 28, 28], "float32"], ["TENSOR", [256, 512, 1, 1], "float32"], [1, 1], [0, 0, 0, 0], [1, 1], "float32"], {}], "config": {"index": 14355527, "code_hash": null, "entity": [["tile_f", "sp", [-1, 4, 16, 1]], ["tile_y", "sp", [-1, 7, 1, 1]], ["tile_x", "sp", [-1, 1, 14, 1]], ["tile_rc", "sp", [-1, 16]], ["tile_ry", "sp", [-1, 1]], ["tile_rx", "sp", [-1, 1]], ["auto_unroll_max_step", "ot", 1500], ["unroll_explicit", "ot", 1]]}, "result": [[6.817245349817365e-05], 0, 1.8578715324401855, 1626492075.3375762], "version": 0.2, "tvm_version": "0.8.dev0"}
{"input": ["cuda -keys=cuda,gpu -max_num_threads=1024 -model=unknown -thread_warp_size=32", "group_conv2d_nchw.cuda", [["TENSOR", [1, 256, 28, 28], "float32"], ["TENSOR", [256, 8, 3, 3], "float32"], [1, 1], [1, 1, 1, 1], [1, 1], 32, "float32"], {}], "config": {"index": 35602068, "code_hash": null, "entity": [["tile_n", "sp", [-1, 1, 1, 1]], ["tile_g", "sp", [-1, 1]], ["tile_f", "sp", [-1, 1, 2, 4]], ["tile_y", "sp", [-1, 7, 1, 1]], ["tile_x", "sp", [-1, 1, 28, 1]], ["tile_rc", "sp", [-1, 2]], ["tile_ry", "sp", [-1, 1]], ["tile_rx", "sp", [-1, 3]], ["auto_unroll_max_step", "ot", 1500], ["unroll_explicit", "ot", 1], ["fuse_yx", "ot", 1]]}, "result": [[8.852757536688029e-06], 0, 2.025989294052124, 1626494064.0409105], "version": 0.2, "tvm_version": "0.8.dev0"}
{"input": ["cuda -keys=cuda,gpu -max_num_threads=1024 -model=unknown -thread_warp_size=32", "conv2d_nchw.cuda", [["TENSOR", [1, 256, 28, 28], "float32"], ["TENSOR", [512, 256, 1, 1], "float32"], [1, 1], [0, 0, 0, 0], [1, 1], "float32"], {}], "config": {"index": 13878290, "code_hash": null, "entity": [["tile_f", "sp", [-1, 8, 8, 1]], ["tile_y", "sp", [-1, 7, 1, 1]], ["tile_x", "sp", [-1, 1, 28, 1]], ["tile_rc", "sp", [-1, 8]], ["tile_ry", "sp", [-1, 1]], ["tile_rx", "sp", [-1, 1]], ["auto_unroll_max_step", "ot", 512], ["unroll_explicit", "ot", 1]]}, "result": [[5.3827988789237674e-05], 0, 1.9264540672302246, 1626495443.7654123], "version": 0.2, "tvm_version": "0.8.dev0"}
{"input": ["cuda -keys=cuda,gpu -max_num_threads=1024 -model=unknown -thread_warp_size=32", "conv2d_nchw.cuda", [["TENSOR", [1, 512, 28, 28], "float32"], ["TENSOR", [512, 512, 1, 1], "float32"], [1, 1], [0, 0, 0, 0], [1, 1], "float32"], {}], "config": {"index": 18812281, "code_hash": null, "entity": [["tile_f", "sp", [-1, 4, 8, 2]], ["tile_y", "sp", [-1, 1, 1, 7]], ["tile_x", "sp", [-1, 1, 28, 1]], ["tile_rc", "sp", [-1, 8]], ["tile_ry", "sp", [-1, 1]], ["tile_rx", "sp", [-1, 1]], ["auto_unroll_max_step", "ot", 1500], ["unroll_explicit", "ot", 1]]}, "result": [[0.0001034334256440281], 0, 1.6937673091888428, 1626497207.6904433], "version": 0.2, "tvm_version": "0.8.dev0"}
{"input": ["cuda -keys=cuda,gpu -max_num_threads=1024 -model=unknown -thread_warp_size=32", "group_conv2d_nchw.cuda", [["TENSOR", [1, 512, 28, 28], "float32"], ["TENSOR", [512, 16, 3, 3], "float32"], [2, 2], [1, 1, 1, 1], [1, 1], 32, "float32"], {}], "config": {"index": 12770700, "code_hash": null, "entity": [["tile_n", "sp", [-1, 1, 1, 1]], ["tile_g", "sp", [-1, 1]], ["tile_f", "sp", [-1, 1, 4, 4]], ["tile_y", "sp", [-1, 1, 1, 7]], ["tile_x", "sp", [-1, 1, 14, 1]], ["tile_rc", "sp", [-1, 4]], ["tile_ry", "sp", [-1, 3]], ["tile_rx", "sp", [-1, 3]], ["auto_unroll_max_step", "ot", 1500], ["unroll_explicit", "ot", 1], ["fuse_yx", "ot", 1]]}, "result": [[1.1065141940085594e-05], 0, 2.445007562637329, 1626500233.3787591], "version": 0.2, "tvm_version": "0.8.dev0"}
{"input": ["cuda -keys=cuda,gpu -max_num_threads=1024 -model=unknown -thread_warp_size=32", "conv2d_nchw.cuda", [["TENSOR", [1, 1024, 14, 14], "float32"], ["TENSOR", [512, 1024, 1, 1], "float32"], [1, 1], [0, 0, 0, 0], [1, 1], "float32"], {}], "config": {"index": 2675669, "code_hash": null, "entity": [["tile_f", "sp", [-1, 4, 8, 1]], ["tile_y", "sp", [-1, 7, 1, 1]], ["tile_x", "sp", [-1, 1, 14, 1]], ["tile_rc", "sp", [-1, 8]], ["tile_ry", "sp", [-1, 1]], ["tile_rx", "sp", [-1, 1]], ["auto_unroll_max_step", "ot", 512], ["unroll_explicit", "ot", 1]]}, "result": [[9.355944224806203e-05], 0, 1.7359504699707031, 1626502512.1678226], "version": 0.2, "tvm_version": "0.8.dev0"}
{"input": ["cuda -keys=cuda,gpu -max_num_threads=1024 -model=unknown -thread_warp_size=32", "group_conv2d_nchw.cuda", [["TENSOR", [1, 512, 14, 14], "float32"], ["TENSOR", [512, 16, 3, 3], "float32"], [1, 1], [1, 1, 1, 1], [1, 1], 32, "float32"], {}], "config": {"index": 6158814, "code_hash": null, "entity": [["tile_n", "sp", [-1, 1, 1, 1]], ["tile_g", "sp", [-1, 1]], ["tile_f", "sp", [-1, 1, 8, 2]], ["tile_y", "sp", [-1, 1, 1, 14]], ["tile_x", "sp", [-1, 1, 14, 1]], ["tile_rc", "sp", [-1, 16]], ["tile_ry", "sp", [-1, 1]], ["tile_rx", "sp", [-1, 3]], ["auto_unroll_max_step", "ot", 1500], ["unroll_explicit", "ot", 1], ["fuse_yx", "ot", 0]]}, "result": [[9.204861383486041e-06], 0, 2.2560760974884033, 1626504351.0298436], "version": 0.2, "tvm_version": "0.8.dev0"}
{"input": ["cuda -keys=cuda,gpu -max_num_threads=1024 -model=unknown -thread_warp_size=32", "conv2d_nchw.cuda", [["TENSOR", [1, 512, 14, 14], "float32"], ["TENSOR", [1024, 512, 1, 1], "float32"], [1, 1], [0, 0, 0, 0], [1, 1], "float32"], {}], "config": {"index": 3188361, "code_hash": null, "entity": [["tile_f", "sp", [-1, 8, 8, 1]], ["tile_y", "sp", [-1, 1, 1, 7]], ["tile_x", "sp", [-1, 1, 14, 1]], ["tile_rc", "sp", [-1, 8]], ["tile_ry", "sp", [-1, 1]], ["tile_rx", "sp", [-1, 1]], ["auto_unroll_max_step", "ot", 512], ["unroll_explicit", "ot", 1]]}, "result": [[6.513420064987815e-05], 0, 1.6758694648742676, 1626505765.1059318], "version": 0.2, "tvm_version": "0.8.dev0"}
{"input": ["cuda -keys=cuda,gpu -max_num_threads=1024 -model=unknown -thread_warp_size=32", "conv2d_nchw.cuda", [["TENSOR", [1, 1024, 14, 14], "float32"], ["TENSOR", [1024, 1024, 1, 1], "float32"], [1, 1], [0, 0, 0, 0], [1, 1], "float32"], {}], "config": {"index": 1122876, "code_hash": null, "entity": [["tile_f", "sp", [-1, 4, 16, 1]], ["tile_y", "sp", [-1, 1, 7, 1]], ["tile_x", "sp", [-1, 7, 2, 1]], ["tile_rc", "sp", [-1, 16]], ["tile_ry", "sp", [-1, 1]], ["tile_rx", "sp", [-1, 1]], ["auto_unroll_max_step", "ot", 512], ["unroll_explicit", "ot", 0]]}, "result": [[0.00012990500107238606], 0, 1.6851868629455566, 1626507134.8757927], "version": 0.2, "tvm_version": "0.8.dev0"}
{"input": ["cuda -keys=cuda,gpu -max_num_threads=1024 -model=unknown -thread_warp_size=32", "group_conv2d_nchw.cuda", [["TENSOR", [1, 1024, 14, 14], "float32"], ["TENSOR", [1024, 32, 3, 3], "float32"], [2, 2], [1, 1, 1, 1], [1, 1], 32, "float32"], {}], "config": {"index": 761250, "code_hash": null, "entity": [["tile_n", "sp", [-1, 1, 1, 1]], ["tile_g", "sp", [-1, 1]], ["tile_f", "sp", [-1, 1, 16, 2]], ["tile_y", "sp", [-1, 7, 1, 1]], ["tile_x", "sp", [-1, 1, 7, 1]], ["tile_rc", "sp", [-1, 8]], ["tile_ry", "sp", [-1, 3]], ["tile_rx", "sp", [-1, 3]], ["auto_unroll_max_step", "ot", 1500], ["unroll_explicit", "ot", 1], ["fuse_yx", "ot", 0]]}, "result": [[1.2891169910138375e-05], 0, 2.323153018951416, 1626508515.49547], "version": 0.2, "tvm_version": "0.8.dev0"}
{"input": ["cuda -keys=cuda,gpu -max_num_threads=1024 -model=unknown -thread_warp_size=32", "conv2d_nchw.cuda", [["TENSOR", [1, 2048, 7, 7], "float32"], ["TENSOR", [1024, 2048, 1, 1], "float32"], [1, 1], [0, 0, 0, 0], [1, 1], "float32"], {}], "config": {"index": 240565, "code_hash": null, "entity": [["tile_f", "sp", [-1, 2, 16, 1]], ["tile_y", "sp", [-1, 7, 1, 1]], ["tile_x", "sp", [-1, 1, 7, 1]], ["tile_rc", "sp", [-1, 16]], ["tile_ry", "sp", [-1, 1]], ["tile_rx", "sp", [-1, 1]], ["auto_unroll_max_step", "ot", 512], ["unroll_explicit", "ot", 1]]}, "result": [[0.00014893021052631578], 0, 1.6161813735961914, 1626509985.4288378], "version": 0.2, "tvm_version": "0.8.dev0"}
{"input": ["cuda -keys=cuda,gpu -max_num_threads=1024 -model=unknown -thread_warp_size=32", "group_conv2d_nchw.cuda", [["TENSOR", [1, 1024, 7, 7], "float32"], ["TENSOR", [1024, 32, 3, 3], "float32"], [1, 1], [1, 1, 1, 1], [1, 1], 32, "float32"], {}], "config": {"index": 1535394, "code_hash": null, "entity": [["tile_n", "sp", [-1, 1, 1, 1]], ["tile_g", "sp", [-1, 1]], ["tile_f", "sp", [-1, 1, 16, 2]], ["tile_y", "sp", [-1, 7, 1, 1]], ["tile_x", "sp", [-1, 1, 7, 1]], ["tile_rc", "sp", [-1, 8]], ["tile_ry", "sp", [-1, 3]], ["tile_rx", "sp", [-1, 3]], ["auto_unroll_max_step", "ot", 1500], ["unroll_explicit", "ot", 1], ["fuse_yx", "ot", 1]]}, "result": [[1.1638886808342001e-05], 0, 2.2955946922302246, 1626512199.1697915], "version": 0.2, "tvm_version": "0.8.dev0"}
{"input": ["cuda -keys=cuda,gpu -max_num_threads=1024 -model=unknown -thread_warp_size=32", "conv2d_nchw.cuda", [["TENSOR", [1, 1024, 7, 7], "float32"], ["TENSOR", [2048, 1024, 1, 1], "float32"], [1, 1], [0, 0, 0, 0], [1, 1], "float32"], {}], "config": {"index": 277113, "code_hash": null, "entity": [["tile_f", "sp", [-1, 2, 8, 2]], ["tile_y", "sp", [-1, 7, 1, 1]], ["tile_x", "sp", [-1, 1, 7, 1]], ["tile_rc", "sp", [-1, 8]], ["tile_ry", "sp", [-1, 1]], ["tile_rx", "sp", [-1, 1]], ["auto_unroll_max_step", "ot", 512], ["unroll_explicit", "ot", 1]]}, "result": [[0.00010217582265591854], 0, 1.59462308883667, 1626513430.9190736], "version": 0.2, "tvm_version": "0.8.dev0"}
